{
  "$schema": "modkit/card@1",
  "id": "mf_essence_question",
  "name": {
    "zh-Hans": "奶蛋？精粹",
    "en": "Milk Egg? Essence"
  },
  "cost": [],
  "rarity": "Common",
  "colors": [
    "Green",
    "Black"
  ],
  "resolve": "OnCast",
  "artTemplate": "Block",
  "keywords": [
    "Fragile"
  ],
  "effects": [
    {
      "custom": "mf_essence_question"
    }
  ]
}
